{
  "schema": "ardyn.phase-5.14.runtime-rollback-kill-switch-boundary-contract",
  "schemaVersion": "0.1.0",
  "phase": "phase-5.14-runtime-rollback-kill-switch-boundary",
  "artifactKind": "runtime-rollback-kill-switch-boundary-contract",
  "metadataGeneratedAt": "1970-01-01T00:00:00.000Z",
  "sourcePhase": {
    "phase": "phase-5.13-runtime-process-control-boundary",
    "document": "docs/phase-5-13-runtime-process-control-boundary.md",
    "fixture": "tests/fixtures/host-policy/phase5-13/runtime-process-control-boundary-contract.json",
    "runtimeEnabled": false,
    "processControlBoundaryImplemented": false,
    "processControlBoundaryActive": false,
    "rollbackKillSwitchBoundaryImplemented": false
  },
  "contractSummary": {
    "runtimeRollbackKillSwitchBoundaryRecorded": true,
    "rollbackKillSwitchRequiredBeforeRuntimeEnablement": true,
    "rollbackKillSwitchBoundaryImplemented": false,
    "rollbackKillSwitchBoundaryActive": false,
    "missingRollbackKillSwitchBoundaryRejected": true,
    "invalidRollbackKillSwitchBoundaryRejected": true,
    "nonDeterministicOrManualOnlyRollbackRejected": true,
    "validRestrictiveRollbackKillSwitchBoundaryPrerequisiteOnly": true,
    "validRestrictiveRollbackKillSwitchBoundaryEnablesRuntime": false,
    "validRestrictiveRollbackKillSwitchBoundaryStartsRuntime": false,
    "validRestrictiveRollbackKillSwitchBoundaryExposesRuntimeExecution": false,
    "runtimeEnabled": false,
    "runtimeCommandEnabled": false,
    "runtimeExecutionEnabled": false,
    "serveRuntimeStillDefaultBlocked": true,
    "dryRunBypassesBlock": false,
    "requiresSeparateRollbackKillSwitchRuntimeImplementationReview": true,
    "requiresRemainingPhase56Preconditions": true,
    "canEnableRuntime": false
  },
  "rollbackKillSwitchBoundaryShape": {
    "futureBoundaryKind": "runtime-rollback-kill-switch-boundary",
    "validRestrictivePrerequisiteRule": true,
    "requiredBeforeRuntimeEnablement": [
      "deterministic-runtime-disable-path",
      "bounded-kill-switch-activation-policy",
      "rollback-state-restoration-policy",
      "rollback-smoke-and-verification-policy",
      "operator-visible-rollback-status-policy",
      "kill-switch-failure-classification-before-runtime-start",
      "no-rollback-or-kill-switch-through-dry-run",
      "rollback-kill-switch-boundary-tests",
      "separate-rollback-kill-switch-runtime-implementation-review"
    ],
    "rejectedBoundaryShapes": [
      "missing-rollback-kill-switch-boundary",
      "invalid-rollback-kill-switch-boundary",
      "non-deterministic-or-manual-only-rollback",
      "rollback-without-runtime-disable-path",
      "kill-switch-without-bounded-activation-policy",
      "rollback-without-verification-smoke",
      "rollback-without-status-reporting",
      "rollback-that-depends-on-unreviewed-process-termination"
    ],
    "requiredRestrictiveControls": [
      "no-runtime-enable-before-rollback-path-is-reviewed",
      "rollback-path-must-fail-before-runtime-start-on-mismatch",
      "kill-switch-activation-must-be-deterministic-and-bounded",
      "rollback-must-preserve-runtime-disabled-default",
      "rollback-must-prove-runtime-command-blocked-after-activation",
      "kill-switch-cannot-spawn-or-terminate-processes-in-this-phase",
      "rollback-cannot-write-transcripts-or-audits-in-this-phase",
      "rollback-cannot-expose-runtime-command-aliases",
      "dry-run-cannot-activate-or-bypass-kill-switch"
    ],
    "falseFieldsUntilImplemented": [
      "rollbackKillSwitchBoundaryImplemented",
      "rollbackKillSwitchBoundaryActive",
      "rollbackCommandEnabled",
      "killSwitchCommandEnabled",
      "runtimeShutdownEnabled",
      "processTerminationEnabled",
      "runtimeEnablementAuthorized",
      "runtimeExecutionAuthorized"
    ],
    "validPrerequisiteRule": "valid_restrictive_rollback_kill_switch_boundary_is_necessary_but_not_sufficient_and_must_not_enable_start_or_expose_runtime"
  },
  "rollbackKillSwitchBoundaryCases": [
    {
      "caseId": "missing-rollback-kill-switch-boundary",
      "classification": "missing_rollback_kill_switch_boundary_rejected",
      "rollbackKillSwitchBoundaryPresent": false,
      "rollbackKillSwitchBoundaryValid": false,
      "rollbackKillSwitchBoundaryRestrictive": false,
      "prerequisiteSignalRecognized": false,
      "rejectedForRuntimeEnablement": true,
      "rejectionReasons": [
        "rollback_kill_switch_boundary_missing",
        "rollback_kill_switch_boundary_not_implemented",
        "runtime_enable_preconditions_unsatisfied"
      ],
      "rollbackKillSwitchEffect": {
        "rollbackKillSwitchBoundaryImplemented": false,
        "rollbackKillSwitchBoundaryActive": false,
        "rollbackKillSwitchBoundaryEvaluated": false,
        "rollbackCommandEnabled": false,
        "killSwitchCommandEnabled": false,
        "runtimeShutdownEnabled": false,
        "runtimeRollbackPerformed": false,
        "killSwitchActivated": false,
        "rollbackVerificationPerformed": false,
        "processTerminationEnabled": false,
        "runtimeEnablementAuthorized": false,
        "runtimeExecutionAuthorized": false
      },
      "runtimeEffect": {
        "runtimeEnabled": false,
        "runtimeStarts": false,
        "runtimeCommandEnabled": false,
        "runtimeExecutionEnabled": false,
        "runtimeExecutionExposed": false
      }
    },
    {
      "caseId": "invalid-rollback-kill-switch-boundary",
      "classification": "invalid_rollback_kill_switch_boundary_rejected",
      "rollbackKillSwitchBoundaryPresent": true,
      "rollbackKillSwitchBoundaryValid": false,
      "rollbackKillSwitchBoundaryRestrictive": false,
      "prerequisiteSignalRecognized": false,
      "rejectedForRuntimeEnablement": true,
      "rejectionReasons": [
        "rollback_kill_switch_boundary_invalid",
        "rollback_kill_switch_boundary_not_implemented",
        "runtime_enable_preconditions_unsatisfied"
      ],
      "rollbackKillSwitchEffect": {
        "rollbackKillSwitchBoundaryImplemented": false,
        "rollbackKillSwitchBoundaryActive": false,
        "rollbackKillSwitchBoundaryEvaluated": false,
        "rollbackCommandEnabled": false,
        "killSwitchCommandEnabled": false,
        "runtimeShutdownEnabled": false,
        "runtimeRollbackPerformed": false,
        "killSwitchActivated": false,
        "rollbackVerificationPerformed": false,
        "processTerminationEnabled": false,
        "runtimeEnablementAuthorized": false,
        "runtimeExecutionAuthorized": false
      },
      "runtimeEffect": {
        "runtimeEnabled": false,
        "runtimeStarts": false,
        "runtimeCommandEnabled": false,
        "runtimeExecutionEnabled": false,
        "runtimeExecutionExposed": false
      }
    },
    {
      "caseId": "non-deterministic-or-manual-only-rollback",
      "classification": "non_deterministic_or_manual_only_rollback_rejected",
      "rollbackKillSwitchBoundaryPresent": true,
      "rollbackKillSwitchBoundaryValid": false,
      "rollbackKillSwitchBoundaryRestrictive": false,
      "prerequisiteSignalRecognized": false,
      "rejectedForRuntimeEnablement": true,
      "rejectionReasons": [
        "rollback_path_non_deterministic",
        "rollback_path_manual_only",
        "kill_switch_activation_unbounded",
        "rollback_verification_missing"
      ],
      "rollbackKillSwitchEffect": {
        "rollbackKillSwitchBoundaryImplemented": false,
        "rollbackKillSwitchBoundaryActive": false,
        "rollbackKillSwitchBoundaryEvaluated": false,
        "rollbackCommandEnabled": false,
        "killSwitchCommandEnabled": false,
        "runtimeShutdownEnabled": false,
        "runtimeRollbackPerformed": false,
        "killSwitchActivated": false,
        "rollbackVerificationPerformed": false,
        "processTerminationEnabled": false,
        "runtimeEnablementAuthorized": false,
        "runtimeExecutionAuthorized": false
      },
      "runtimeEffect": {
        "runtimeEnabled": false,
        "runtimeStarts": false,
        "runtimeCommandEnabled": false,
        "runtimeExecutionEnabled": false,
        "runtimeExecutionExposed": false
      }
    },
    {
      "caseId": "valid-restrictive-rollback-kill-switch-boundary-prerequisite-only",
      "classification": "valid_restrictive_rollback_kill_switch_boundary_prerequisite_only",
      "rollbackKillSwitchBoundaryPresent": true,
      "rollbackKillSwitchBoundaryValid": true,
      "rollbackKillSwitchBoundaryRestrictive": true,
      "prerequisiteSignalRecognized": true,
      "rejectedForRuntimeEnablement": true,
      "rejectionReasons": [
        "rollback_kill_switch_runtime_implementation_not_implemented",
        "process_control_runtime_implementation_not_implemented",
        "transcript_audit_runtime_implementation_not_implemented",
        "stdio_safety_runtime_implementation_not_implemented",
        "host_policy_runtime_enforcement_not_implemented",
        "approval_evaluator_not_implemented",
        "approval_grant_not_produced",
        "runtime_enable_preconditions_unsatisfied"
      ],
      "rollbackKillSwitchEffect": {
        "rollbackKillSwitchBoundaryImplemented": false,
        "rollbackKillSwitchBoundaryActive": false,
        "rollbackKillSwitchBoundaryEvaluated": false,
        "rollbackCommandEnabled": false,
        "killSwitchCommandEnabled": false,
        "runtimeShutdownEnabled": false,
        "runtimeRollbackPerformed": false,
        "killSwitchActivated": false,
        "rollbackVerificationPerformed": false,
        "processTerminationEnabled": false,
        "runtimeEnablementAuthorized": false,
        "runtimeExecutionAuthorized": false
      },
      "runtimeEffect": {
        "runtimeEnabled": false,
        "runtimeStarts": false,
        "runtimeCommandEnabled": false,
        "runtimeExecutionEnabled": false,
        "runtimeExecutionExposed": false
      }
    }
  ],
  "validationRules": {